{
  "id": "encounter.common.the-night-watch",
  "category": "shelter",
  "title": "The night watch",
  "premise": "Shelter: the small decisions of holding a base.",
  "requirements": {
    "requiresShelter": true
  },
  "scope": "run",
  "stages": [
    {
      "id": "s",
      "narration": "Your place holds. Tonight, anyway. But holding it is a job that never quite ends: a gap in the boards you keep meaning to close, stores that want counting, and the plain question of whether to close that gap now or just keep watch and let the night pass.",
      "choices": [
        {
          "id": "shore",
          "label": "Shore up the weak board with what scrap you have",
          "timeCost": 2,
          "requirements": {
            "carriesItem": "item.scrap"
          },
          "effects": [
            {
              "kind": "takeItem",
              "item": "item.scrap",
              "quantity": 1
            },
            {
              "kind": "adjustMind",
              "stress": -8
            },
            {
              "kind": "logHistory",
              "event": "encounter.note",
              "note": "shored up the barricade"
            }
          ]
        },
        {
          "id": "watch",
          "label": "Take the watch yourself and let the night pass",
          "timeCost": 2,
          "effects": [
            {
              "kind": "adjustMind",
              "stress": -5
            },
            {
              "kind": "adjustNeed",
              "need": "fatigue",
              "delta": 10
            }
          ]
        }
      ]
    }
  ],
  "notes": "Shelter-category beat; the scrap option is gated on carrying it (a choice-level requirement). Actually sleeping the night through is the dedicated 'Sleep until morning' base action (T58), which runs the clock to 08:00 and recovers by the hours slept — not a beat choice; this one is only the tension of holding the line before you turn in."
}
